{
  "schemaVersion": "1.0.0",
  "manifestType": "section-notes",
  "pageKey": "home-v1",
  "sourceManifestPath": "figma/home-v1/source-manifest.json",
  "sections": [
    {
      "id": "hero-section",
      "implementationPolicy": {
        "pattern": "carousel",
        "defaultImplementation": "swiper",
        "repeatedContentSource": "blocks",
        "themeCodeReuse": "avoid"
      },
      "skillRoutingOverride": {
        "recommendedSkill": "skills/theme/implement-section-from-figma/SKILL.md",
        "reason": "Force the static section skill even when the manifest classified this section differently."
      },
      "agentPrompt": "Implement this section as a 3-slide Swiper carousel, 每一个slide可以使用同一张图片",
      "humanNotes": [
        "Stub generated by init-section-notes from figma/home-v1/source-manifest.json.",
        "Add overrides by setting any of: implementationPolicy, skillRoutingOverride, agentPrompt. See harness/notes/home-v1.example.json for shapes and harness/contracts/section-notes.schema.json for the full schema. Sections without overrides may be deleted from this array."
      ]
    },
    {
      "id": "reviews-and-pr-mentions",
      "humanNotes": [
        "Stub generated by init-section-notes from figma/home-v1/source-manifest.json.",
        "Add overrides by setting any of: implementationPolicy, skillRoutingOverride, agentPrompt. See harness/notes/home-v1.example.json for shapes and harness/contracts/section-notes.schema.json for the full schema. Sections without overrides may be deleted from this array."
      ]
    },
    {
      "id": "why-pococo-section",
      "humanNotes": [
        "Stub generated by init-section-notes from figma/home-v1/source-manifest.json.",
        "Add overrides by setting any of: implementationPolicy, skillRoutingOverride, agentPrompt. See harness/notes/home-v1.example.json for shapes and harness/contracts/section-notes.schema.json for the full schema. Sections without overrides may be deleted from this array."
      ]
    },
    {
      "id": "featured-products",
      "humanNotes": [
        "Stub generated by init-section-notes from figma/home-v1/source-manifest.json.",
        "Add overrides by setting any of: implementationPolicy, skillRoutingOverride, agentPrompt. See harness/notes/home-v1.example.json for shapes and harness/contracts/section-notes.schema.json for the full schema. Sections without overrides may be deleted from this array."
      ]
    },
    {
      "id": "how-it-is-works",
      "humanNotes": [
        "Stub generated by init-section-notes from figma/home-v1/source-manifest.json.",
        "Add overrides by setting any of: implementationPolicy, skillRoutingOverride, agentPrompt. See harness/notes/home-v1.example.json for shapes and harness/contracts/section-notes.schema.json for the full schema. Sections without overrides may be deleted from this array."
      ]
    },
    {
      "id": "use-scenarios",
      "humanNotes": [
        "Stub generated by init-section-notes from figma/home-v1/source-manifest.json.",
        "Add overrides by setting any of: implementationPolicy, skillRoutingOverride, agentPrompt. See harness/notes/home-v1.example.json for shapes and harness/contracts/section-notes.schema.json for the full schema. Sections without overrides may be deleted from this array."
      ]
    },
    {
      "id": "pococo-vs-competitor",
      "humanNotes": [
        "Stub generated by init-section-notes from figma/home-v1/source-manifest.json.",
        "Add overrides by setting any of: implementationPolicy, skillRoutingOverride, agentPrompt. See harness/notes/home-v1.example.json for shapes and harness/contracts/section-notes.schema.json for the full schema. Sections without overrides may be deleted from this array."
      ]
    },
    {
      "id": "discs-products",
      "humanNotes": [
        "Stub generated by init-section-notes from figma/home-v1/source-manifest.json.",
        "Add overrides by setting any of: implementationPolicy, skillRoutingOverride, agentPrompt. See harness/notes/home-v1.example.json for shapes and harness/contracts/section-notes.schema.json for the full schema. Sections without overrides may be deleted from this array."
      ]
    },
    {
      "id": "benefit-section-tabs",
      "humanNotes": [
        "Stub generated by init-section-notes from figma/home-v1/source-manifest.json.",
        "Add overrides by setting any of: implementationPolicy, skillRoutingOverride, agentPrompt. See harness/notes/home-v1.example.json for shapes and harness/contracts/section-notes.schema.json for the full schema. Sections without overrides may be deleted from this array."
      ]
    },
    {
      "id": "about-us",
      "humanNotes": [
        "Stub generated by init-section-notes from figma/home-v1/source-manifest.json.",
        "Add overrides by setting any of: implementationPolicy, skillRoutingOverride, agentPrompt. See harness/notes/home-v1.example.json for shapes and harness/contracts/section-notes.schema.json for the full schema. Sections without overrides may be deleted from this array."
      ]
    },
    {
      "id": "blog-tips",
      "humanNotes": [
        "Stub generated by init-section-notes from figma/home-v1/source-manifest.json.",
        "Add overrides by setting any of: implementationPolicy, skillRoutingOverride, agentPrompt. See harness/notes/home-v1.example.json for shapes and harness/contracts/section-notes.schema.json for the full schema. Sections without overrides may be deleted from this array."
      ]
    },
    {
      "id": "trust-badges",
      "humanNotes": [
        "Stub generated by init-section-notes from figma/home-v1/source-manifest.json.",
        "Add overrides by setting any of: implementationPolicy, skillRoutingOverride, agentPrompt. See harness/notes/home-v1.example.json for shapes and harness/contracts/section-notes.schema.json for the full schema. Sections without overrides may be deleted from this array."
      ]
    },
    {
      "id": "footer",
      "humanNotes": [
        "Stub generated by init-section-notes from figma/home-v1/source-manifest.json.",
        "Add overrides by setting any of: implementationPolicy, skillRoutingOverride, agentPrompt. See harness/notes/home-v1.example.json for shapes and harness/contracts/section-notes.schema.json for the full schema. Sections without overrides may be deleted from this array."
      ]
    }
  ]
}
